{"screen_id":"workbench","platform":"web","primary_user":"employee","user_task":"处理今日待办并查看重点事项","information":{"L1":["todo","exceptions","primary_action"],"L2":["work_items"],"L3":["metrics"],"L4":["time","source"]},"actions":{"primary":"process_next","secondary":["open_detail"],"dangerous":["withdraw"]},"required_states":["loading","empty","error","permission_denied"],"acceptance_criteria":["audit visible","mobile usable"]}
