{"screen_id":"service-home","platform":"mobile","primary_user":"member","user_task":"查看下一步计划并快速完成预约或使用权益","information":{"L1":["next_action","booking","benefits"],"L2":["recommendations"],"L3":["history"],"L4":["terms"]},"actions":{"primary":"continue_plan","secondary":["browse","save"],"dangerous":["cancel_booking"]},"required_states":["loading","empty","error"],"acceptance_criteria":["touch targets >=44","fees and rules visible","no stereotype-driven layout"]}
